[
  {
    "id": "paris",
    "name": "Paris",
    "type": "city",
    "characteristics": {
      "continent": "europe",
      "country": "france",
      "region": "western_europe",
      "is_capital": true,
      "is_coastal": false,
      "population_millions": 2.2,
      "metro_population_millions": 12.4,
      "has_metro": true,
      "has_airport": true,
      "climate": "oceanic",
      "founded_year": -300,
      "hosted_olympics": true,
      "olympic_years": [1900, 1924, 2024],
      "has_skyscrapers": false,
      "famous_landmarks": ["eiffel_tower", "louvre", "arc_de_triomphe", "notre_dame"],
      "known_for": ["fashion", "art", "culture", "cuisine", "romance"],
      "has_major_river": true,
      "river_name": "seine",
      "unesco_heritage": true
    },
    "metadata": {
      "added_date": "2026-02-03T00:00:00Z",
      "last_updated": "2026-02-03T00:00:00Z",
      "contributors": ["initial_setup"],
      "verified": true,
      "description": "Capital of France, known as the City of Light"
    },
    "aliases": ["City of Light", "City of Love"]
  },
  {
    "id": "tokyo",
    "name": "Tokyo",
    "type": "city",
    "characteristics": {
      "continent": "asia",
      "country": "japan",
      "region": "east_asia",
      "is_capital": true,
      "is_coastal": true,
      "population_millions": 14,
      "metro_population_millions": 37.4,
      "has_metro": true,
      "has_airport": true,
      "climate": "humid_subtropical",
      "founded_year": 1457,
      "hosted_olympics": true,
      "olympic_years": [1964, 2020],
      "has_skyscrapers": true,
      "famous_landmarks": ["tokyo_tower", "shibuya_crossing", "senso_ji", "imperial_palace"],
      "known_for": ["technology", "anime", "food", "fashion", "neon_lights"],
      "largest_metro_population": true,
      "has_sumo": true,
      "cherry_blossoms": true
    },
    "metadata": {
      "added_date": "2026-02-03T00:00:00Z",
      "last_updated": "2026-02-03T00:00:00Z",
      "contributors": ["initial_setup"],
      "verified": true,
      "description": "Japan's capital, largest metropolitan area in the world"
    },
    "aliases": ["Edo"]
  },
  {
    "id": "new_york",
    "name": "New York City",
    "type": "city",
    "characteristics": {
      "continent": "north_america",
      "country": "usa",
      "region": "northeast_usa",
      "is_capital": false,
      "is_coastal": true,
      "population_millions": 8.3,
      "metro_population_millions": 20.1,
      "has_metro": true,
      "has_airport": true,
      "climate": "humid_subtropical",
      "founded_year": 1624,
      "has_skyscrapers": true,
      "famous_landmarks": ["statue_of_liberty", "empire_state_building", "times_square", "central_park"],
      "known_for": ["finance", "broadway", "diversity", "skyline", "pizza"],
      "financial_center": true,
      "has_boroughs": true,
      "broadway": true
    },
    "metadata": {
      "added_date": "2026-02-03T00:00:00Z",
      "last_updated": "2026-02-03T00:00:00Z",
      "contributors": ["initial_setup"],
      "verified": true,
      "description": "Largest city in USA, global financial and cultural hub"
    },
    "aliases": ["NYC", "The Big Apple", "New York"]
  },
  {
    "id": "london",
    "name": "London",
    "type": "city",
    "characteristics": {
      "continent": "europe",
      "country": "uk",
      "region": "western_europe",
      "is_capital": true,
      "is_coastal": false,
      "population_millions": 9.0,
      "metro_population_millions": 14.2,
      "has_metro": true,
      "has_airport": true,
      "climate": "oceanic",
      "founded_year": 43,
      "hosted_olympics": true,
      "olympic_years": [1908, 1948, 2012],
      "has_skyscrapers": true,
      "famous_landmarks": ["big_ben", "tower_bridge", "buckingham_palace", "london_eye"],
      "known_for": ["history", "royalty", "finance", "theater", "tea"],
      "has_ancient_history": true,
      "has_major_river": true,
      "river_name": "thames",
      "financial_center": true
    },
    "metadata": {
      "added_date": "2026-02-03T00:00:00Z",
      "last_updated": "2026-02-03T00:00:00Z",
      "contributors": ["initial_setup"],
      "verified": true,
      "description": "Capital of UK with rich history and global influence"
    },
    "aliases": ["The Big Smoke"]
  },
  {
    "id": "dhaka",
    "name": "Dhaka",
    "type": "city",
    "characteristics": {
      "continent": "asia",
      "country": "bangladesh",
      "region": "south_asia",
      "is_capital": true,
      "is_coastal": false,
      "population_millions": 10.2,
      "metro_population_millions": 22.4,
      "has_metro": true,
      "has_airport": true,
      "climate": "tropical",
      "founded_year": 1608,
      "has_skyscrapers": false,
      "famous_landmarks": ["lalbagh_fort", "ahsan_manzil", "national_parliament"],
      "known_for": ["textiles", "rickshaws", "food", "rivers"],
      "textile_industry": true,
      "densely_populated": true,
      "has_major_rivers": true,
      "rickshaw_capital": true
    },
    "metadata": {
      "added_date": "2026-02-03T00:00:00Z",
      "last_updated": "2026-02-03T00:00:00Z",
      "contributors": ["initial_setup"],
      "verified": true,
      "description": "Capital of Bangladesh, major textile and cultural hub"
    },
    "aliases": ["City of Mosques"]
  },
  {
    "id": "dubai",
    "name": "Dubai",
    "type": "city",
    "characteristics": {
      "continent": "asia",
      "country": "uae",
      "region": "middle_east",
      "is_capital": false,
      "is_coastal": true,
      "population_millions": 3.5,
      "metro_population_millions": 3.5,
      "has_metro": true,
      "has_airport": true,
      "climate": "arid",
      "has_skyscrapers": true,
      "famous_landmarks": ["burj_khalifa", "palm_jumeirah", "burj_al_arab"],
      "known_for": ["luxury", "shopping", "modern_architecture", "desert"],
      "has_tallest_building": true,
      "artificial_islands": true,
      "desert_city": true,
      "shopping_destination": true
    },
    "metadata": {
      "added_date": "2026-02-03T00:00:00Z",
      "last_updated": "2026-02-03T00:00:00Z",
      "contributors": ["initial_setup"],
      "verified": true,
      "description": "Modern city in UAE known for luxury and architecture"
    },
    "aliases": []
  },
  {
    "id": "rome",
    "name": "Rome",
    "type": "city",
    "characteristics": {
      "continent": "europe",
      "country": "italy",
      "region": "southern_europe",
      "is_capital": true,
      "is_coastal": false,
      "population_millions": 2.8,
      "metro_population_millions": 4.3,
      "has_metro": true,
      "has_airport": true,
      "climate": "mediterranean",
      "founded_year": -753,
      "has_skyscrapers": false,
      "famous_landmarks": ["colosseum", "vatican", "pantheon", "trevi_fountain"],
      "known_for": ["ancient_history", "art", "architecture", "cuisine", "religion"],
      "has_ancient_ruins": true,
      "unesco_heritage": true,
      "ancient_empire_capital": true,
      "contains_country": true
    },
    "metadata": {
      "added_date": "2026-02-03T00:00:00Z",
      "last_updated": "2026-02-03T00:00:00Z",
      "contributors": ["initial_setup"],
      "verified": true,
      "description": "Ancient city, capital of Italy and former Roman Empire"
    },
    "aliases": ["The Eternal City"]
  },
  {
    "id": "sydney",
    "name": "Sydney",
    "type": "city",
    "characteristics": {
      "continent": "oceania",
      "country": "australia",
      "region": "australasia",
      "is_capital": false,
      "is_coastal": true,
      "population_millions": 5.3,
      "metro_population_millions": 5.3,
      "has_metro": false,
      "has_airport": true,
      "climate": "humid_subtropical",
      "founded_year": 1788,
      "hosted_olympics": true,
      "olympic_years": [2000],
      "has_skyscrapers": true,
      "famous_landmarks": ["opera_house", "harbour_bridge", "bondi_beach"],
      "known_for": ["beaches", "harbor", "opera_house", "lifestyle"],
      "has_iconic_building": true,
      "harbor_city": true,
      "beach_culture": true
    },
    "metadata": {
      "added_date": "2026-02-03T00:00:00Z",
      "last_updated": "2026-02-03T00:00:00Z",
      "contributors": ["initial_setup"],
      "verified": true,
      "description": "Largest Australian city with iconic Opera House and beautiful harbor"
    },
    "aliases": []
  },
  {
    "id": "cairo",
    "name": "Cairo",
    "type": "city",
    "characteristics": {
      "continent": "africa",
      "country": "egypt",
      "region": "north_africa",
      "is_capital": true,
      "is_coastal": false,
      "population_millions": 10.0,
      "metro_population_millions": 21.3,
      "has_metro": true,
      "has_airport": true,
      "climate": "arid",
      "founded_year": 969,
      "has_skyscrapers": false,
      "famous_landmarks": ["pyramids_nearby", "sphinx", "egyptian_museum"],
      "known_for": ["pyramids", "ancient_history", "nile_river", "museums"],
      "near_ancient_wonders": true,
      "has_major_river": true,
      "river_name": "nile",
      "largest_city_in_africa": true
    },
    "metadata": {
      "added_date": "2026-02-03T00:00:00Z",
      "last_updated": "2026-02-03T00:00:00Z",
      "contributors": ["initial_setup"],
      "verified": true,
      "description": "Egyptian capital near ancient pyramids and on the Nile"
    },
    "aliases": []
  },
  {
    "id": "singapore",
    "name": "Singapore",
    "type": "city",
    "characteristics": {
      "continent": "asia",
      "country": "singapore",
      "region": "southeast_asia",
      "is_capital": true,
      "is_coastal": true,
      "is_island": true,
      "is_city_state": true,
      "population_millions": 5.7,
      "metro_population_millions": 5.7,
      "has_metro": true,
      "has_airport": true,
      "climate": "tropical",
      "has_skyscrapers": true,